### ISSUE TITLE
{handshake_timeout,frame_header} issue with RabbitMQ 3.6.14 + Erlang 18.3

### ISSUE THREAD

**Issue by mabondarenko** [CopernicaMarketingSoftware/AMQP-CPP#161]
Hi
I`m using c63f62189e2fa4a21a227119dfee2de82af766f0 with boost asio
Problem is not appeared with RabbitMQ 3.5.7, Erlang 18.3.

But on version RabbitMQ 3.6.14 client-part receives the error `Connection reset by peer` after 7 sec from negotiation begining.

```
=INFO REPORT==== 6-Jan-2018::18:32:25 ===
accepting AMQP connection <0.14896.8> (172.16.254.6:60140 -> 10.0.0.14:5672)

=ERROR REPORT==== 6-Jan-2018::18:32:32 ===
closing AMQP connection <0.14896.8> (172.16.254.6:60140 -> 10.0.0.14:5672):
{handshake_timeout,frame_header}

=INFO REPORT==== 6-Jan-2018::19:28:32 ===
accepting AMQP connection <0.15501.8> (172.16.254.6:32868 -> 10.0.0.14:5672)

=ERROR REPORT==== 6-Jan-2018::19:28:39 ===
closing AMQP connection <0.15501.8> (172.16.254.6:32868 -> 10.0.0.14:5672):
{handshake_timeout,frame_header}
```

```
reading from file 1.pcap, link-type LINUX_SLL (Linux cooked)
18:32:22.692456 IP 172.16.254.6.60140 > 10.0.0.14.amqp: Flags [S], seq 2321681081, win 29200, options [mss 1341,sackOK,TS val 942073756 ecr 0,nop,wscale 7], length 0
18:32:22.692567 IP 10.0.0.14.amqp > 172.16.254.6.60140: Flags [S.], seq 713926718, ack 2321681082, win 26844, options [mss 8960,sackOK,TS val 39517411 ecr 942073756,nop,wscale 9], length 0
18:32:22.930777 IP 172.16.254.6.60140 > 10.0.0.14.amqp: Flags [.], ack 1, win 229, options [nop,nop,TS val 942073816 ecr 39517411], length 0
18:32:25.433949 IP 172.16.254.6.60140 > 10.0.0.14.amqp: Flags [P.], seq 1:9, ack 1, win 229, options [nop,nop,TS val 942074441 ecr 39517411], length 8
18:32:25.433987 IP 10.0.0.14.amqp > 172.16.254.6.60140: Flags [.], ack 9, win 53, options [nop,nop,TS val 39518096 ecr 942074441], length 0
18:32:25.435629 IP 10.0.0.14.amqp > 172.16.254.6.60140: Flags [P.], seq 1:500, ack 9, win 53, options [nop,nop,TS val 39518097 ecr 942074441], length 499
18:32:25.598055 IP 172.16.254.6.60140 > 10.0.0.14.amqp: Flags [.], ack 500, win 237, options [nop,nop,TS val 942074482 ecr 39518097], length 0
18:32:25.599459 IP 172.16.254.6.60140 > 10.0.0.14.amqp: Flags [P.], seq 9:276, ack 500, win 237, options [nop,nop,TS val 942074483 ecr 39518097], length 267
18:32:25.599724 IP 10.0.0.14.amqp > 172.16.254.6.60140: Flags [P.], seq 500:520, ack 276, win 55, options [nop,nop,TS val 39518138 ecr 942074483], length 20
18:32:25.802699 IP 172.16.254.6.60140 > 10.0.0.14.amqp: Flags [.], ack 520, win 237, options [nop,nop,TS val 942074534 ecr 39518138], length 0
18:32:32.932328 IP 10.0.0.14.amqp > 172.16.254.6.60140: Flags [R.], seq 520, ack 276, win 55, options [nop,nop,TS val 39519971 ecr 942074534], length 0
```

<img width="1680" alt="screenshot 2018-01-06 21 34 35" src="https://user-images.githubusercontent.com/19592244/34643203-5121a5b6-f331-11e7-889c-a22529a96cb0.png">
<img width="1680" alt="screenshot 2018-01-06 21 36 45" src="https://user-images.githubusercontent.com/19592244/34643204-567d2a62-f331-11e7-928d-b07acf3373b8.png">

Problem is very similar to https://github.com/pdezwart/php-amqp/issues/108

**Comment by mabondarenko** [comment]
the same with libev.
RabbitMQ 3.6.14, default settings.

```
[2018-01-17 23:14:02.498501] [0x00007f777da9b740] [info]    onNegotiate 60
[2018-01-17 23:14:12.318425] [0x00007f777da9b740] [info]    onError Connection reset by peer
```
code we use:

```c++
#include "../types.h"
#include "../trace.h"
#include <ev.h>
#include <amqpcpp.h>
#include <amqpcpp/libev.h>
#include <boost/scoped_ptr.hpp>

using namespace pew;

class TcpHandler : public AMQP::TcpHandler
{
  PEW_DISALLOW_COPY_AND_ASSIGN(TcpHandler);

public:
  TcpHandler(struct ev_loop *loop) : impl_(new AMQP::LibEvHandler(loop)) {}
  virtual ~TcpHandler() {}

protected:
  virtual uint16_t onNegotiate(AMQP::TcpConnection* connection, uint16_t interval) override
  {
    PEW_INFO("onNegotiate " << interval);
    return impl_->onNegotiate(connection, interval);
  }
  virtual void onConnected(AMQP::TcpConnection* connection) override
  {
    PEW_INFO("onConnected");
    return impl_->onConnected(connection);
  }
  virtual void onHeartbeat(AMQP::TcpConnection* connection) override
  {
    PEW_INFO("onHeartbeat");
    return impl_->onHeartbeat(connection);
  }
  virtual void onError(AMQP::TcpConnection* connection, const char *message) override
  {
    PEW_INFO("onError " << message);
    return impl_->onError(connection, message);
  }
  virtual void onClosed(AMQP::TcpConnection* connection) override
  {
    PEW_INFO("onClosed");
    return impl_->onClosed(connection);
  }
  virtual void monitor(AMQP::TcpConnection* connection, int fd, int flags) override
  {
    return impl_->monitor(connection, fd, flags);
  }

private:
  boost::scoped_ptr<AMQP::TcpHandler> impl_;
};


int main(int argc, char** argv)
{
  // access to the event loop
  auto *loop = EV_DEFAULT;

  // handler for libev
  TcpHandler handler(loop);

  // make a connection
  AMQP::TcpConnection connection(&handler, AMQP::Address("amqp://login:password@10.0.0.14:5672"));

  // we need a channel too
  AMQP::TcpChannel channel(&connection);

  // create a temporary queue
  channel.declareQueue("myqueue").onSuccess([&connection](const std::string &name, uint32_t messagecount, uint32_t consumercount) {

    // report the name of the temporary queue
    PEW_INFO("declared queue " << name );

    // now we can close the connection
    connection.close();
  });

  // run the loop
  ev_run(loop, 0);

  // done
  return 0;
}
```

**Comment by EmielBruijntjes** [comment]
I modified your code slightly to be able to compile it:

````c++
#include <ev.h>
#include <amqpcpp.h>
#include <amqpcpp/libev.h>
#include <boost/scoped_ptr.hpp>


class TcpHandler : public AMQP::LibEvHandler
{
public:
  TcpHandler(struct ev_loop *loop) : AMQP::LibEvHandler(loop) {}
  virtual ~TcpHandler() {}

protected:
  virtual void onConnected(AMQP::TcpConnection* connection) override
  {
    std::cout << "onConnected" << std::endl;
    return AMQP::LibEvHandler::onConnected(connection);
  }
  virtual void onError(AMQP::TcpConnection* connection, const char *message) override
  {
    std::cout << "onError " << message << std::endl;
    return AMQP::LibEvHandler::onError(connection, message);
  }
  virtual void onClosed(AMQP::TcpConnection* connection) override
  {
    std::cout << "onClosed" << std::endl;
    return AMQP::LibEvHandler::onClosed(connection);
  }
};


int main(int argc, char** argv)
{
  // access to the event loop
  auto *loop = EV_DEFAULT;

  // handler for libev
  TcpHandler handler(loop);

  // make a connection
  AMQP::TcpConnection connection(&handler, AMQP::Address("amqp://guest:guest@localhost"));

  // we need a channel too
  AMQP::TcpChannel channel(&connection);
  
  // create a temporary queue
  channel.declareQueue("myqueue").onSuccess([&connection](const std::string &name, uint32_t messagecount, uint32_t consumercount) {

    // report the name of the temporary queue
    std::cout << "declared queue " << name << std::endl;

    // now we can close the connection
    connection.close();
  });

  // run the loop
  ev_run(loop, 0);

  // done
  return 0;
}
````

I compiled it with the following command:

````
g++ -std=c++11 test.cpp -lev -lamqpcpp -lpthread
````

I connected with RabbitMQ version 3.6.15 running Erlang 20.0.4. I got the following output:

````
onConnected
declared queue myqueue
onClosed
````

So it seems to work here. How can I reproduce this issue?

**Comment by mabondarenko** [comment]
Your modified code still does not want to work :( 
The output is:
```
onError Connection reset by peer
```
We use RabbitMQ **3.6.14** in couple with Erlang **18.3** and we connecting to remote host, not to local.

**Comment by EmielBruijntjes** [comment]
Are the userename and password valid? RabbitMQ simply closes the connection on error. There is not more than I can do, I dont find it reasonable to expect me to spend many hours to set up an environment that is equal to your environment.

**Comment by mabondarenko** [comment]
In case of wrong credintals server returns corresponding error. I checked it first of all. Local connection to 3.6.14 works fine, but not remote. `librabbitmq-c` works fine in any cases. Thank you for support.

**Comment by EmielBruijntjes** [comment]
Remote connections work just as well here. But not with exactly the same version setup as your environment. Is it only for this specific RabbitMQ version that you are having problems?

**Comment by mabondarenko** [comment]
I have a hypothesis that the problem is related to the processing of server errors in the library in case of client/user with no appropriate rights have trying to declare a queue or exchange before the network connection/negotiation has been established. Or queue or exchange already exists on server with different settings. But I do not get any corresponding errors from the library. Only `connection reset by peer` error that means server closed connection by unknown reason.... I will try to investigate this issue. Let you know.

**Comment by kobigi** [comment]
Hi 
was there a fix for that ?
i m having similar errors with rabbitmq-server-3.6.5-1.el7.noarch
which at the end of teh day rabbit is stopped on the first controller and does not com up

**Comment by EmielBruijntjes** [comment]
We have been bringing out a new version of the library because RabbitMQ did indeed not handle the heartbeat interval as we expected (and this behavior was also changed in between versions). Is this still an issue?
