### ISSUE TITLE
Connection lost due to heartbeat ignore

### ISSUE THREAD

**Issue by matwey** [CopernicaMarketingSoftware/AMQP-CPP#440]
**Describe the bug**

I am using:
 - AMQP-CPP 4.3.15 with `libboostasio` `TcpHandler`.
 - RabbitMQ 3.8.11

I don't do anything more complex than the example, so I didn't changed default the heartbeat behavior somehow.
Using pcap dump I see the following connection negotiation steps:

```
Frame 10: 86 bytes on wire (688 bits), 86 bytes captured (688 bits) on interface eth0, id 0
    Interface id: 0 (eth0)
        Interface name: eth0
    Encapsulation type: Ethernet (1)
    Arrival Time: Nov 29, 2021 14:21:17.782187767 MSK
    [Time shift for this packet: 0.000000000 seconds]
    Epoch Time: 1638184877.782187767 seconds
    [Time delta from previous captured frame: 0.000259074 seconds]
    [Time delta from previous displayed frame: 0.000259074 seconds]
    [Time since reference or first frame: 0.003860519 seconds]
    Frame Number: 10
    Frame Length: 86 bytes (688 bits)
    Capture Length: 86 bytes (688 bits)
    [Frame is marked: False]
    [Frame is ignored: False]
    [Protocols in frame: eth:ethertype:ip:tcp:amqp]
    [Coloring Rule Name: TCP]
    [Coloring Rule String: tcp]
Ethernet II, Src: VMware_19:a0:42 (00:0c:29:19:a0:42), Dst: VECOW_05:03:49 (20:46:a1:05:03:49)
    Destination: VECOW_05:03:49 (20:46:a1:05:03:49)
        Address: VECOW_05:03:49 (20:46:a1:05:03:49)
        .... ..0. .... .... .... .... = LG bit: Globally unique address (factory default)
        .... ...0 .... .... .... .... = IG bit: Individual address (unicast)
    Source: VMware_19:a0:42 (00:0c:29:19:a0:42)
        Address: VMware_19:a0:42 (00:0c:29:19:a0:42)
        .... ..0. .... .... .... .... = LG bit: Globally unique address (factory default)
        .... ...0 .... .... .... .... = IG bit: Individual address (unicast)
    Type: IPv4 (0x0800)
Internet Protocol Version 4, Src: 192.168.15.111, Dst: 192.168.15.112
    0100 .... = Version: 4
    .... 0101 = Header Length: 20 bytes (5)
    Differentiated Services Field: 0x00 (DSCP: CS0, ECN: Not-ECT)
        0000 00.. = Differentiated Services Codepoint: Default (0)
        .... ..00 = Explicit Congestion Notification: Not ECN-Capable Transport (0)
    Total Length: 72
    Identification: 0x28bb (10427)
    Flags: 0x40, Don't fragment
        0... .... = Reserved bit: Not set
        .1.. .... = Don't fragment: Set
        ..0. .... = More fragments: Not set
    Fragment Offset: 0
    Time to Live: 64
    Protocol: TCP (6)
    Header Checksum: 0x71c5 [validation disabled]
    [Header checksum status: Unverified]
    Source Address: 192.168.15.111
    Destination Address: 192.168.15.112
Transmission Control Protocol, Src Port: 5672, Dst Port: 38166, Seq: 514, Ack: 275, Len: 20
    Source Port: 5672
    Destination Port: 38166
    [Stream index: 0]
    [TCP Segment Len: 20]
    Sequence Number: 514    (relative sequence number)
    Sequence Number (raw): 2765358590
    [Next Sequence Number: 534    (relative sequence number)]
    Acknowledgment Number: 275    (relative ack number)
    Acknowledgment number (raw): 25711864
    1000 .... = Header Length: 32 bytes (8)
    Flags: 0x018 (PSH, ACK)
        000. .... .... = Reserved: Not set
        ...0 .... .... = Nonce: Not set
        .... 0... .... = Congestion Window Reduced (CWR): Not set
        .... .0.. .... = ECN-Echo: Not set
        .... ..0. .... = Urgent: Not set
        .... ...1 .... = Acknowledgment: Set
        .... .... 1... = Push: Set
        .... .... .0.. = Reset: Not set
        .... .... ..0. = Syn: Not set
        .... .... ...0 = Fin: Not set
        [TCP Flags: ·······AP···]
    Window: 507
    [Calculated window size: 64896]
    [Window size scaling factor: 128]
    Checksum: 0xa06a [unverified]
    [Checksum Status: Unverified]
    Urgent Pointer: 0
    Options: (12 bytes), No-Operation (NOP), No-Operation (NOP), Timestamps
        TCP Option - No-Operation (NOP)
            Kind: No-Operation (1)
        TCP Option - No-Operation (NOP)
            Kind: No-Operation (1)
        TCP Option - Timestamps: TSval 2414017056, TSecr 1584561058
            Kind: Time Stamp Option (8)
            Length: 10
            Timestamp value: 2414017056
            Timestamp echo reply: 1584561058
    [SEQ/ACK analysis]
        [iRTT: 0.000682851 seconds]
        [Bytes in flight: 20]
        [Bytes sent since last PSH flag: 20]
    [Timestamps]
        [Time since first frame in this TCP stream: 0.003860519 seconds]
        [Time since previous frame in this TCP stream: 0.000259074 seconds]
    TCP payload (20 bytes)
    [PDU Size: 20]
Advanced Message Queueing Protocol
    Type: Method (1)
    Channel: 0
    Length: 12
    Class: Connection (10)
    Method: Tune (30)
    Arguments
        Channel-Max: 2047
        Frame-Max: 131072
        Heartbeat: 60
```

Note, that the server suggest `heartbeat: 60`, and the client (AMQP-CPP) agrees with this suggestion:

```
Frame 12: 86 bytes on wire (688 bits), 86 bytes captured (688 bits) on interface eth0, id 0
    Interface id: 0 (eth0)
        Interface name: eth0
    Encapsulation type: Ethernet (1)
    Arrival Time: Nov 29, 2021 14:21:17.782688949 MSK
    [Time shift for this packet: 0.000000000 seconds]
    Epoch Time: 1638184877.782688949 seconds
    [Time delta from previous captured frame: 0.000208720 seconds]
    [Time delta from previous displayed frame: 0.000208720 seconds]
    [Time since reference or first frame: 0.004361701 seconds]
    Frame Number: 12
    Frame Length: 86 bytes (688 bits)
    Capture Length: 86 bytes (688 bits)
    [Frame is marked: False]
    [Frame is ignored: False]
    [Protocols in frame: eth:ethertype:ip:tcp:amqp]
    [Coloring Rule Name: TCP]
    [Coloring Rule String: tcp]
Ethernet II, Src: VECOW_05:03:49 (20:46:a1:05:03:49), Dst: VMware_19:a0:42 (00:0c:29:19:a0:42)
    Destination: VMware_19:a0:42 (00:0c:29:19:a0:42)
        Address: VMware_19:a0:42 (00:0c:29:19:a0:42)
        .... ..0. .... .... .... .... = LG bit: Globally unique address (factory default)
        .... ...0 .... .... .... .... = IG bit: Individual address (unicast)
    Source: VECOW_05:03:49 (20:46:a1:05:03:49)
        Address: VECOW_05:03:49 (20:46:a1:05:03:49)
        .... ..0. .... .... .... .... = LG bit: Globally unique address (factory default)
        .... ...0 .... .... .... .... = IG bit: Individual address (unicast)
    Type: IPv4 (0x0800)
Internet Protocol Version 4, Src: 192.168.15.112, Dst: 192.168.15.111
    0100 .... = Version: 4
    .... 0101 = Header Length: 20 bytes (5)
    Differentiated Services Field: 0x00 (DSCP: CS0, ECN: Not-ECT)
        0000 00.. = Differentiated Services Codepoint: Default (0)
        .... ..00 = Explicit Congestion Notification: Not ECN-Capable Transport (0)
    Total Length: 72
    Identification: 0xc9a8 (51624)
    Flags: 0x40, Don't fragment
        0... .... = Reserved bit: Not set
        .1.. .... = Don't fragment: Set
        ..0. .... = More fragments: Not set
    Fragment Offset: 0
    Time to Live: 64
    Protocol: TCP (6)
    Header Checksum: 0xd0d7 [validation disabled]
    [Header checksum status: Unverified]
    Source Address: 192.168.15.112
    Destination Address: 192.168.15.111
Transmission Control Protocol, Src Port: 38166, Dst Port: 5672, Seq: 275, Ack: 534, Len: 20
    Source Port: 38166
    Destination Port: 5672
    [Stream index: 0]
    [TCP Segment Len: 20]
    Sequence Number: 275    (relative sequence number)
    Sequence Number (raw): 25711864
    [Next Sequence Number: 295    (relative sequence number)]
    Acknowledgment Number: 534    (relative ack number)
    Acknowledgment number (raw): 2765358610
    1000 .... = Header Length: 32 bytes (8)
    Flags: 0x018 (PSH, ACK)
        000. .... .... = Reserved: Not set
        ...0 .... .... = Nonce: Not set
        .... 0... .... = Congestion Window Reduced (CWR): Not set
        .... .0.. .... = ECN-Echo: Not set
        .... ..0. .... = Urgent: Not set
        .... ...1 .... = Acknowledgment: Set
        .... .... 1... = Push: Set
        .... .... .0.. = Reset: Not set
        .... .... ..0. = Syn: Not set
        .... .... ...0 = Fin: Not set
        [TCP Flags: ·······AP···]
    Window: 501
    [Calculated window size: 64128]
    [Window size scaling factor: 128]
    Checksum: 0x4fe8 [unverified]
    [Checksum Status: Unverified]
    Urgent Pointer: 0
    Options: (12 bytes), No-Operation (NOP), No-Operation (NOP), Timestamps
        TCP Option - No-Operation (NOP)
            Kind: No-Operation (1)
        TCP Option - No-Operation (NOP)
            Kind: No-Operation (1)
        TCP Option - Timestamps: TSval 1584561058, TSecr 2414017056
            Kind: Time Stamp Option (8)
            Length: 10
            Timestamp value: 1584561058
            Timestamp echo reply: 2414017056
    [SEQ/ACK analysis]
        [iRTT: 0.000682851 seconds]
        [Bytes in flight: 20]
        [Bytes sent since last PSH flag: 20]
    [Timestamps]
        [Time since first frame in this TCP stream: 0.004361701 seconds]
        [Time since previous frame in this TCP stream: 0.000208720 seconds]
    TCP payload (20 bytes)
    [PDU Size: 20]
Advanced Message Queueing Protocol
    Type: Method (1)
    Channel: 0
    Length: 12
    Class: Connection (10)
    Method: Tune-Ok (31)
    Arguments
        Channel-Max: 2047
        Frame-Max: 131072
        Heartbeat: 60
```

**Expected behavior and actual behavior**

Actual behavior is that AMQP-CPP ignores heartbeat incoming messages and then the connection is closed by the server.
Excepted behavior would be one of the following:
 - AMQP-CPP should answer to the heartbeats
 - AMQP-CPP should set `0` when `Tune-Ok`.

**Comment by EmielBruijntjes** [comment]
Can you send the smallest possible example program that demonstrates this issue?

**Comment by matwey** [comment]
Sure!

```
#include <boost/asio/io_service.hpp>
#include <boost/asio/strand.hpp>

#include <amqpcpp.h>
#include <amqpcpp/libboostasio.h>

int main() {
    boost::asio::io_service service(4);

    AMQP::LibBoostAsioHandler handler(service);

    AMQP::TcpConnection connection(&handler, AMQP::Address("amqp://guest:guest@localhost/"));
    AMQP::TcpChannel channel(&connection);

    channel.onError([] (const char* message) {
        std::cerr << "AMQP channel: " << message << std::endl;
    });

    return service.run();
}
```

Actual result:

```
> ./example
AMQP channel: connection lost
```

Expected result is running forever.

**Comment by matwey** [comment]
Ping?

**Comment by EmielBruijntjes** [comment]
The boost asio handler is not something that I wrote, checked or tested. I accepted your pull request, I hope it solves the issue for you.

**Comment by matwey** [comment]
Thanks! :+1:
